{
  "part_catalog_version": "ticket-parts-v1",
  "ruleset_version": "first-version-v2",
  "generator_version": "ticket-builder-v3",
  "configuration_version": "ticket-builder-v3",
  "ticket_content_version": "core-ticket-parts-v3",
  "domain_content_version": "core-domain-snapshot-v2",
  "card_catalog_version": "core-card-catalog-coverage-v3",
  "deck_catalog_version": "core-response-decks-v3",
  "outcome_family_version": "diagnostic-outcome-families-v1",
  "command_action_costs": {
    "command.ipmi.sel_elist": 1,
    "command.linux.dhclient": 1,
    "command.linux.dmesg": 1,
    "command.linux.ethtool": 1,
    "command.linux.free_h": 1,
    "command.linux.ip_addr": 1,
    "command.linux.ip_route": 1,
    "command.linux.journalctl": 1,
    "command.linux.lsblk": 1,
    "command.linux.lspci": 1,
    "command.linux.nvme_smart_log": 1,
    "command.linux.smartctl": 1,
    "command.network.ping": 1
  },
  "diagnostic_outcome_families": [
    {
      "part_id": "outcome_family.clean.v1",
      "classification": "CLEAN",
      "public_summary": "The diagnostic completed cleanly and produced no candidate-changing finding in this machine state."
    },
    {
      "part_id": "outcome_family.unrelated.v1",
      "classification": "IRRELEVANT",
      "public_summary": "The diagnostic completed but produced no finding relevant to this Ticket."
    },
    {
      "part_id": "outcome_family.inconclusive.v1",
      "classification": "INCONCLUSIVE",
      "public_summary": "The diagnostic completed, but the observation is inconclusive for the current candidates."
    }
  ],
  "candidate_pool_parts": [
    {
      "part_id": "candidate_pool.public_relationships.v1",
      "selection_rule": "PUBLIC_ASSOCIATED_FAULTS",
      "minimum_candidates": 2,
      "maximum_candidates": 5,
      "distractor_order": "STABLE_ID"
    }
  ],
  "closure_parts": [
    {
      "part_id": "closure.complete_path.v1",
      "include_accepted_isolation": true,
      "include_cited_decisive_evidence": true,
      "include_every_repair_in_accepted_path": true,
      "include_every_failed_verify_in_accepted_path": true,
      "include_all_current_passing_verifies": true
    }
  ],
  "teaching_parts": [
    { "part_id": "teaching.storage.v1", "subsystem": "storage", "difficulty": 2, "objectives": ["Separate storage path, media, and array-state evidence."] },
    { "part_id": "teaching.memory.v1", "subsystem": "memory", "difficulty": 2, "objectives": ["Distinguish seating and population evidence from a failed DIMM."] },
    { "part_id": "teaching.power.v1", "subsystem": "power", "difficulty": 2, "objectives": ["Distinguish a connection state from a failed supply."] },
    { "part_id": "teaching.boot.v1", "subsystem": "boot", "difficulty": 2, "objectives": ["Separate boot selection from device detection and media state."] },
    { "part_id": "teaching.thermal.v1", "subsystem": "thermal", "difficulty": 2, "objectives": ["Use telemetry and physical evidence to isolate the cooling path."] },
    { "part_id": "teaching.network.v1", "subsystem": "network", "difficulty": 2, "objectives": ["Separate physical link evidence from address configuration."] }
  ],
  "fingerprint_roots": [
    { "fingerprint_id": "fingerprint.storage.loose_cable", "subsystem": "storage", "fault_blueprint_part_id": "truth.storage.loose_cable.v1", "selection_weight": 1 },
    { "fingerprint_id": "fingerprint.storage.failed_sas_member", "subsystem": "storage", "fault_blueprint_part_id": "truth.storage.failed_sas_member.v1", "selection_weight": 1 },
    { "fingerprint_id": "fingerprint.memory.unseated_dimm", "subsystem": "memory", "fault_blueprint_part_id": "truth.memory.unseated_dimm.v1", "selection_weight": 1 },
    { "fingerprint_id": "fingerprint.memory.failed_dimm", "subsystem": "memory", "fault_blueprint_part_id": "truth.memory.failed_dimm.v1", "selection_weight": 1 },
    { "fingerprint_id": "fingerprint.power.unseated_psu", "subsystem": "power", "fault_blueprint_part_id": "truth.power.unseated_psu.v1", "selection_weight": 1 },
    { "fingerprint_id": "fingerprint.power.failed_psu", "subsystem": "power", "fault_blueprint_part_id": "truth.power.failed_psu.v1", "selection_weight": 1 },
    { "fingerprint_id": "fingerprint.boot.incorrect_order", "subsystem": "boot", "fault_blueprint_part_id": "truth.boot.incorrect_order.v1", "selection_weight": 1 },
    { "fingerprint_id": "fingerprint.boot.missing_nvme", "subsystem": "boot", "fault_blueprint_part_id": "truth.boot.missing_nvme.v1", "selection_weight": 1 },
    { "fingerprint_id": "fingerprint.thermal.failed_fan", "subsystem": "thermal", "fault_blueprint_part_id": "truth.thermal.failed_fan.v1", "selection_weight": 1 },
    { "fingerprint_id": "fingerprint.thermal.clogged_heatsink", "subsystem": "thermal", "fault_blueprint_part_id": "truth.thermal.clogged_heatsink.v1", "selection_weight": 1 },
    { "fingerprint_id": "fingerprint.network.failed_cable", "subsystem": "network", "fault_blueprint_part_id": "truth.network.failed_cable.v1", "selection_weight": 1 },
    { "fingerprint_id": "fingerprint.network.incorrect_static_ip", "subsystem": "network", "fault_blueprint_part_id": "truth.network.incorrect_static_ip.v1", "selection_weight": 1 }
  ],
  "public_context_parts": [
    { "part_id": "context.storage.io_errors.v1", "compatible_fault_blueprint_part_ids": ["truth.storage.loose_cable.v1"], "symptom_ids": ["symptom.storage.io_errors"], "display_name": "Intermittent Storage Path", "short_description": "Storage operations report errors while the path remains intermittently visible." },
    { "part_id": "context.storage.raid_degraded.v1", "compatible_fault_blueprint_part_ids": ["truth.storage.failed_sas_member.v1"], "symptom_ids": ["symptom.storage.raid_degraded"], "display_name": "One Member Down", "short_description": "The array reports reduced redundancy and a member needs isolation." },
    { "part_id": "context.memory.reduced_capacity.v1", "compatible_fault_blueprint_part_ids": ["truth.memory.unseated_dimm.v1"], "symptom_ids": ["symptom.boot.memory_warning"], "display_name": "Memory Capacity Missing", "short_description": "Firmware reports less memory than the installed configuration expects." },
    { "part_id": "context.memory.intermittent_crash.v1", "compatible_fault_blueprint_part_ids": ["truth.memory.failed_dimm.v1"], "symptom_ids": ["symptom.system.intermittent_crash"], "display_name": "Intermittent Memory Crash", "short_description": "Workloads crash sporadically and memory remains a plausible cause." },
    { "part_id": "context.power.redundancy_unseated.v1", "compatible_fault_blueprint_part_ids": ["truth.power.unseated_psu.v1"], "symptom_ids": ["symptom.power.redundancy_warning"], "display_name": "Redundancy Path Unavailable", "short_description": "One redundant power path is not available to the server." },
    { "part_id": "context.power.redundancy_failed.v1", "compatible_fault_blueprint_part_ids": ["truth.power.failed_psu.v1"], "symptom_ids": ["symptom.power.redundancy_warning"], "display_name": "Supply Redundancy Lost", "short_description": "One redundant supply path reports an active fault." },
    { "part_id": "context.boot.wrong_device.v1", "compatible_fault_blueprint_part_ids": ["truth.boot.incorrect_order.v1"], "symptom_ids": ["symptom.boot.wrong_device"], "display_name": "Booting the Wrong Device", "short_description": "The server selects an unintended boot source." },
    { "part_id": "context.boot.no_device.v1", "compatible_fault_blueprint_part_ids": ["truth.boot.missing_nvme.v1"], "symptom_ids": ["symptom.boot.no_boot_device"], "display_name": "Boot Device Missing", "short_description": "POST completes, but the expected system device is not detected." },
    { "part_id": "context.thermal.high_temp_fan.v1", "compatible_fault_blueprint_part_ids": ["truth.thermal.failed_fan.v1"], "symptom_ids": ["symptom.thermal.high_cpu_temp"], "display_name": "Temperature Rising", "short_description": "Processor temperature rises above the expected operating range." },
    { "part_id": "context.thermal.high_temp_clog.v1", "compatible_fault_blueprint_part_ids": ["truth.thermal.clogged_heatsink.v1"], "symptom_ids": ["symptom.thermal.high_cpu_temp"], "display_name": "Cooling Path Restricted", "short_description": "Processor temperature remains high while the cooling path is investigated." },
    { "part_id": "context.network.no_connectivity_cable.v1", "compatible_fault_blueprint_part_ids": ["truth.network.failed_cable.v1"], "symptom_ids": ["symptom.network.no_connectivity"], "display_name": "Network Path Down", "short_description": "The server cannot reach expected network destinations." },
    { "part_id": "context.network.no_connectivity_static.v1", "compatible_fault_blueprint_part_ids": ["truth.network.incorrect_static_ip.v1"], "symptom_ids": ["symptom.network.no_connectivity"], "display_name": "Addressed but Unreachable", "short_description": "The interface is present, but expected network destinations are unreachable." }
  ],
  "fault_blueprint_parts": [
    { "part_id": "truth.storage.loose_cable.v1", "initial_machine_state_key": "machine.storage.loose_cable.active", "fault_instances": [{ "fault_instance_key": "fault_instance.storage.cable", "fault_id": "fault.storage.cable.loose", "role": "ACTIONABLE", "actionable": true, "deepest": true, "required_to_repair": true }], "causal_edges": [] },